{"archive_ref":null,"category":"PROVIDER_READBACK","data_classification":"INTERNAL","evidence_id":"CSG-06A-EVIDENCE-000001","expected_set_ref":{"digest":"sha256:e716b1534468f6983672c67fd70c8cfd6ba92f241186d8e7c4bfd6ce60f56609","kind":"EXTERNAL_IMMUTABLE","path":"tests/csg/expected-set.v1.json","provider":"GitHub","repository_id_or_resource_id":"1352411536","revision":"52011f429a33e59861df477d62096716a15da1af"},"observed_at":"2026-09-16T08:00:00Z","observed_by":"CHATGPT-CONTROLLER","payload_digest":"sha256:433fa5b28d3aded3144a4f452691577f0b26aa7af57f9e3818c86e9713b5028e","project_id":"CHATGPT_GLOBAL_SKILL_GOVERNANCE","result":"PASS","retention_until":null,"schema_version":"csg.evidence.v1","source_ancestry":["CSG-05","CSG-06A-CANARY"],"source_refs":[{"digest":"sha256:d38945bc6a8ba3d13498e624e4cdfddcd68ca8939c0a758d88e400622205e27e","immutable_ref":{"digest":"sha256:d38945bc6a8ba3d13498e624e4cdfddcd68ca8939c0a758d88e400622205e27e","kind":"EXTERNAL_IMMUTABLE","path":"artifacts/csg/csg-05-local-test-report.txt","provider":"GitHub","repository_id_or_resource_id":"1352411536","revision":"08bda2126f858938410e9ca37625e650846917dc"},"media_type":"text/plain","size":1066},{"digest":"sha256:e60ec49be282f2c0f651b74d8ca31f6ec6554946e884e2a64017ff81eaad3894","immutable_ref":{"digest":"sha256:e60ec49be282f2c0f651b74d8ca31f6ec6554946e884e2a64017ff81eaad3894","kind":"EXTERNAL_IMMUTABLE","path":"artifacts/csg/csg-05-remote-wip-manifest-v1.json","provider":"GitHub","repository_id_or_resource_id":"1352411536","revision":"36455e594a929c23f487266b596f627998eeeb5e"},"media_type":"application/json","size":1839}],"subject":{"contract_digest":"sha256:6893ace4f5e4bb0f7d0432c11308548b2e37095cd873fbec75dfdc5c47e59131","source_commit":{"algorithm":"sha1","hex":"08bda2126f858938410e9ca37625e650846917dc"},"unit_id":"CSG-06A"},"supersedes_ref":null,"verifier_ref":{"digest":"sha256:5c2b87ae1caed15e491d18b7ebd4368ca1950cac25b1e093ed722d72debc8aee","kind":"EXTERNAL_IMMUTABLE","path":"governance/csg/trust-root/csg-trusted-pr-verifier.mjs","provider":"GitHub","repository_id_or_resource_id":"1352411536","revision":"052a19febe6dccb91fe2e91d116ff9f099f21832"}}
